{
  "id": "hermes",
  "name": "Hermes (placeholder)",
  "role": "hermes",
  "department": "Operations",
  "purpose": "Capability adapter placeholder. Hermes is NOT integrated: its real abilities must be inventoried before any capability is claimed. See docs/integrations/hermes-capability-inventory.md.",
  "capabilities": [],
  "non_capabilities": ["everything, until inventoried — no capability is assumed"],
  "accepted_task_types": [],
  "required_inputs": ["capability inventory (from owner)"],
  "output_contract": null,
  "available_tools": [],
  "tool_restrictions": ["no tools until capabilities are documented and approved"],
  "memory_read_scopes": [],
  "memory_write_scopes": [],
  "risk_ceiling": "none",
  "allowed_model_profiles": ["local_private"],
  "default_model_profile": "local_private",
  "reviewer_roles": ["ceo-claude"],
  "escalation_rules": ["any task -> blocked pending capability inventory"],
  "source_provenance": { "origin": "external (Hermes)", "source_hash": null, "imported_prompt": null },
  "version": "0.1.0",
  "status": "discovery_required"
}
